{
  "$schema": "http://json-schema.org/draft-07/schema#",
  "description": "Official Replicate API schema for google/imagen-3-fast",
  "properties": {
    "prompt": {
      "type": "string",
      "title": "Prompt",
      "x-order": 0,
      "description": "Text prompt for image generation"
    },
    "aspect_ratio": {
      "allOf": [
        {
          "$ref": "#/components/schemas/aspect_ratio"
        }
      ],
      "default": "1:1",
      "x-order": 1,
      "description": "Aspect ratio of the generated image"
    },
    "output_format": {
      "allOf": [
        {
          "$ref": "#/components/schemas/output_format"
        }
      ],
      "default": "jpg",
      "x-order": 3,
      "description": "Format of the output image"
    },
    "safety_filter_level": {
      "allOf": [
        {
          "$ref": "#/components/schemas/safety_filter_level"
        }
      ],
      "default": "block_only_high",
      "x-order": 2,
      "description": "block_low_and_above is strictest, block_medium_and_above blocks some prompts, block_only_high is most permissive but some prompts will still be blocked"
    }
  },
  "required": ["prompt"],
  "title": "imagen-3-fast Input Schema",
  "type": "object"
}
